{
  "common": {
    "loading": "Chargement...",
    "error": "Erreur",
    "success": "Succès",
    "save": "Enregistrer",
    "cancel": "Annuler",
    "delete": "Supprimer",
    "edit": "Modifier",
    "create": "Créer",
    "update": "Mettre à jour",
    "confirm": "Confirmer",
    "back": "Retour",
    "next": "Suivant",
    "previous": "Précédent",
    "search": "Rechercher",
    "filter": "Filtrer",
    "clear": "Effacer",
    "export": "Exporter",
    "import": "Importer",
    "refresh": "Actualiser",
    "settings": "Paramètres",
    "language": "Langue",
    "timezone": "Fuseau Horaire",
    "currency": "Devise",
    "region": "Région"
  },
  "navigation": {
    "dashboard": "Tableau de Bord",
    "users": "Utilisateurs",
    "reports": "Rapports",
    "analytics": "Analyses",
    "compliance": "Conformité",
    "security": "Sécurité",
    "monitoring": "Surveillance",
    "logs": "Journaux",
    "alerts": "Alertes",
    "settings": "Paramètres",
    "profile": "Profil",
    "logout": "Déconnexion"
  },
  "auth": {
    "login": "Connexion",
    "logout": "Déconnexion",
    "register": "S'inscrire",
    "forgot_password": "Mot de passe oublié",
    "reset_password": "Réinitialiser le mot de passe",
    "email": "Email",
    "password": "Mot de passe",
    "confirm_password": "Confirmer le mot de passe",
    "remember_me": "Se souvenir de moi",
    "sign_in": "Se connecter",
    "sign_up": "S'inscrire",
    "welcome_back": "Bon retour",
    "create_account": "Créer un compte",
    "invalid_credentials": "Identifiants invalides",
    "password_requirements": "Le mot de passe doit contenir au moins 8 caractères avec majuscule, minuscule, chiffre et caractère spécial"
  },
  "dashboard": {
    "title": "Tableau de Bord Entreprise",
    "overview": "Aperçu",
    "key_metrics": "Métriques Clés",
    "recent_activity": "Activité Récente",
    "quick_actions": "Actions Rapides",
    "system_status": "État du Système",
    "performance": "Performance",
    "security_alerts": "Alertes de Sécurité",
    "compliance_status": "État de Conformité"
  },
  "users": {
    "title": "Gestion des Utilisateurs",
    "create_user": "Créer un Utilisateur",
    "edit_user": "Modifier l'Utilisateur",
    "user_details": "Détails de l'Utilisateur",
    "username": "Nom d'utilisateur",
    "email": "Email",
    "role": "Rôle",
    "status": "Statut",
    "last_login": "Dernière Connexion",
    "created_at": "Créé le",
    "actions": "Actions",
    "active": "Actif",
    "inactive": "Inactif",
    "suspended": "Suspendu",
    "admin": "Administrateur",
    "user": "Utilisateur",
    "manager": "Gestionnaire",
    "viewer": "Observateur"
  },
  "compliance": {
    "title": "Conformité Entreprise",
    "gdpr": "Conformité RGPD",
    "hipaa": "Conformité HIPAA",
    "sox": "Conformité SOX",
    "pci_dss": "Conformité PCI DSS",
    "iso_27001": "ISO 27001",
    "nist": "Cadre NIST",
    "status": "État de Conformité",
    "last_audit": "Dernier Audit",
    "next_review": "Prochaine Révision",
    "compliant": "Conforme",
    "non_compliant": "Non Conforme",
    "pending_review": "En Attente de Révision",
    "remediation_required": "Remédiation Requise"
  },
  "security": {
    "title": "Centre de Sécurité",
    "threat_detection": "Détection des Menaces",
    "vulnerability_scan": "Analyse de Vulnérabilités",
    "access_control": "Contrôle d'Accès",
    "encryption": "Chiffrement",
    "audit_logs": "Journaux d'Audit",
    "incident_response": "Réponse aux Incidents",
    "risk_assessment": "Évaluation des Risques",
    "security_policies": "Politiques de Sécurité",
    "multi_factor_auth": "Authentification Multi-Facteurs",
    "zero_trust": "Architecture Zéro Confiance"
  },
  "monitoring": {
    "title": "Surveillance du Système",
    "uptime": "Temps de Fonctionnement",
    "response_time": "Temps de Réponse",
    "error_rate": "Taux d'Erreur",
    "throughput": "Débit",
    "cpu_usage": "Utilisation CPU",
    "memory_usage": "Utilisation Mémoire",
    "disk_usage": "Utilisation Disque",
    "network_traffic": "Trafic Réseau",
    "database_performance": "Performance Base de Données",
    "api_health": "Santé API"
  },
  "legal": {
    "terms_of_service": "Conditions de Service",
    "privacy_policy": "Politique de Confidentialité",
    "cookie_policy": "Politique des Cookies",
    "data_processing": "Accord de Traitement des Données",
    "gdpr_notice": "Avis RGPD",
    "ccpa_notice": "Avis CCPA",
    "regional_compliance": "Conformité Régionale",
    "data_retention": "Politique de Rétention des Données",
    "right_to_deletion": "Droit à l'Effacement",
    "data_portability": "Portabilité des Données"
  },
  "enterprise": {
    "sla": "Accord de Niveau de Service",
    "business_continuity": "Continuité des Activités",
    "disaster_recovery": "Récupération après Sinistre",
    "backup_status": "État des Sauvegardes",
    "failover": "Basculement",
    "high_availability": "Haute Disponibilité",
    "load_balancing": "Équilibrage de Charge",
    "auto_scaling": "Mise à l'Échelle Automatique",
    "multi_region": "Multi-Région",
    "global_deployment": "Déploiement Global"
  },
  "validation": {
    "required": "Ce champ est obligatoire",
    "invalid_email": "Veuillez saisir une adresse email valide",
    "password_too_short": "Le mot de passe doit contenir au moins 8 caractères",
    "passwords_do_not_match": "Les mots de passe ne correspondent pas",
    "invalid_format": "Format invalide",
    "min_length": "La longueur minimale est de {min} caractères",
    "max_length": "La longueur maximale est de {max} caractères",
    "numeric_only": "Seuls les chiffres sont autorisés",
    "alphanumeric_only": "Seules les lettres et les chiffres sont autorisés"
  },
  "errors": {
    "generic": "Une erreur inattendue s'est produite",
    "network": "Erreur réseau. Veuillez vérifier votre connexion",
    "server": "Erreur serveur. Veuillez réessayer plus tard",
    "unauthorized": "Vous n'êtes pas autorisé à effectuer cette action",
    "forbidden": "Accès refusé",
    "not_found": "Ressource non trouvée",
    "validation": "Veuillez corriger les erreurs surlignées",
    "timeout": "Délai d'attente dépassé. Veuillez réessayer",
    "rate_limit": "Trop de requêtes. Veuillez attendre et réessayer"
  },
  "success": {
    "created": "Créé avec succès",
    "updated": "Mis à jour avec succès",
    "deleted": "Supprimé avec succès",
    "saved": "Enregistré avec succès",
    "uploaded": "Téléchargé avec succès",
    "downloaded": "Téléchargé avec succès",
    "imported": "Importé avec succès",
    "exported": "Exporté avec succès",
    "synchronized": "Synchronisé avec succès"
  }
}