{
  "common": {
    "loading": "Cargando...",
    "error": "Error",
    "success": "Éxito",
    "save": "Guardar",
    "cancel": "Cancelar",
    "delete": "Eliminar",
    "edit": "Editar",
    "create": "Crear",
    "update": "Actualizar",
    "confirm": "Confirmar",
    "back": "Atrás",
    "next": "Siguiente",
    "previous": "Anterior",
    "search": "Buscar",
    "filter": "Filtrar",
    "clear": "Limpiar",
    "export": "Exportar",
    "import": "Importar",
    "refresh": "Actualizar",
    "settings": "Configuración",
    "language": "Idioma",
    "timezone": "Zona Horaria",
    "currency": "Moneda",
    "region": "Región"
  },
  "navigation": {
    "dashboard": "Panel de Control",
    "users": "Usuarios",
    "reports": "Reportes",
    "analytics": "Análisis",
    "compliance": "Cumplimiento",
    "security": "Seguridad",
    "monitoring": "Monitoreo",
    "logs": "Registros",
    "alerts": "Alertas",
    "settings": "Configuración",
    "profile": "Perfil",
    "logout": "Cerrar Sesión"
  },
  "auth": {
    "login": "Iniciar Sesión",
    "logout": "Cerrar Sesión",
    "register": "Registrarse",
    "forgot_password": "Olvidé mi Contraseña",
    "reset_password": "Restablecer Contraseña",
    "email": "Correo Electrónico",
    "password": "Contraseña",
    "confirm_password": "Confirmar Contraseña",
    "remember_me": "Recordarme",
    "sign_in": "Iniciar Sesión",
    "sign_up": "Registrarse",
    "welcome_back": "Bienvenido de vuelta",
    "create_account": "Crear cuenta",
    "invalid_credentials": "Credenciales inválidas",
    "password_requirements": "La contraseña debe tener al menos 8 caracteres con mayúscula, minúscula, número y carácter especial"
  },
  "dashboard": {
    "title": "Panel Empresarial",
    "overview": "Resumen",
    "key_metrics": "Métricas Clave",
    "recent_activity": "Actividad Reciente",
    "quick_actions": "Acciones Rápidas",
    "system_status": "Estado del Sistema",
    "performance": "Rendimiento",
    "security_alerts": "Alertas de Seguridad",
    "compliance_status": "Estado de Cumplimiento"
  },
  "users": {
    "title": "Gestión de Usuarios",
    "create_user": "Crear Usuario",
    "edit_user": "Editar Usuario",
    "user_details": "Detalles del Usuario",
    "username": "Nombre de Usuario",
    "email": "Correo Electrónico",
    "role": "Rol",
    "status": "Estado",
    "last_login": "Último Inicio de Sesión",
    "created_at": "Creado el",
    "actions": "Acciones",
    "active": "Activo",
    "inactive": "Inactivo",
    "suspended": "Suspendido",
    "admin": "Administrador",
    "user": "Usuario",
    "manager": "Gerente",
    "viewer": "Visualizador"
  },
  "compliance": {
    "title": "Cumplimiento Empresarial",
    "gdpr": "Cumplimiento GDPR",
    "hipaa": "Cumplimiento HIPAA",
    "sox": "Cumplimiento SOX",
    "pci_dss": "Cumplimiento PCI DSS",
    "iso_27001": "ISO 27001",
    "nist": "Marco NIST",
    "status": "Estado de Cumplimiento",
    "last_audit": "Última Auditoría",
    "next_review": "Próxima Revisión",
    "compliant": "Cumple",
    "non_compliant": "No Cumple",
    "pending_review": "Revisión Pendiente",
    "remediation_required": "Remediación Requerida"
  },
  "security": {
    "title": "Centro de Seguridad",
    "threat_detection": "Detección de Amenazas",
    "vulnerability_scan": "Escaneo de Vulnerabilidades",
    "access_control": "Control de Acceso",
    "encryption": "Encriptación",
    "audit_logs": "Registros de Auditoría",
    "incident_response": "Respuesta a Incidentes",
    "risk_assessment": "Evaluación de Riesgos",
    "security_policies": "Políticas de Seguridad",
    "multi_factor_auth": "Autenticación Multi-Factor",
    "zero_trust": "Arquitectura de Confianza Cero"
  },
  "monitoring": {
    "title": "Monitoreo del Sistema",
    "uptime": "Tiempo de Actividad",
    "response_time": "Tiempo de Respuesta",
    "error_rate": "Tasa de Errores",
    "throughput": "Rendimiento",
    "cpu_usage": "Uso de CPU",
    "memory_usage": "Uso de Memoria",
    "disk_usage": "Uso de Disco",
    "network_traffic": "Tráfico de Red",
    "database_performance": "Rendimiento de Base de Datos",
    "api_health": "Salud de API"
  },
  "legal": {
    "terms_of_service": "Términos de Servicio",
    "privacy_policy": "Política de Privacidad",
    "cookie_policy": "Política de Cookies",
    "data_processing": "Acuerdo de Procesamiento de Datos",
    "gdpr_notice": "Aviso GDPR",
    "ccpa_notice": "Aviso CCPA",
    "regional_compliance": "Cumplimiento Regional",
    "data_retention": "Política de Retención de Datos",
    "right_to_deletion": "Derecho al Olvido",
    "data_portability": "Portabilidad de Datos"
  },
  "enterprise": {
    "sla": "Acuerdo de Nivel de Servicio",
    "business_continuity": "Continuidad del Negocio",
    "disaster_recovery": "Recuperación ante Desastres",
    "backup_status": "Estado de Respaldos",
    "failover": "Conmutación por Error",
    "high_availability": "Alta Disponibilidad",
    "load_balancing": "Balanceador de Carga",
    "auto_scaling": "Escalado Automático",
    "multi_region": "Multi-Región",
    "global_deployment": "Despliegue Global"
  },
  "validation": {
    "required": "Este campo es obligatorio",
    "invalid_email": "Por favor ingrese un correo electrónico válido",
    "password_too_short": "La contraseña debe tener al menos 8 caracteres",
    "passwords_do_not_match": "Las contraseñas no coinciden",
    "invalid_format": "Formato inválido",
    "min_length": "La longitud mínima es {min} caracteres",
    "max_length": "La longitud máxima es {max} caracteres",
    "numeric_only": "Solo se permiten números",
    "alphanumeric_only": "Solo se permiten letras y números"
  },
  "errors": {
    "generic": "Ocurrió un error inesperado",
    "network": "Error de red. Por favor verifique su conexión",
    "server": "Error del servidor. Por favor intente más tarde",
    "unauthorized": "No está autorizado para realizar esta acción",
    "forbidden": "Acceso denegado",
    "not_found": "Recurso no encontrado",
    "validation": "Por favor corrija los errores resaltados",
    "timeout": "Tiempo de espera agotado. Por favor intente de nuevo",
    "rate_limit": "Demasiadas solicitudes. Por favor espere e intente de nuevo"
  },
  "success": {
    "created": "Creado exitosamente",
    "updated": "Actualizado exitosamente",
    "deleted": "Eliminado exitosamente",
    "saved": "Guardado exitosamente",
    "uploaded": "Subido exitosamente",
    "downloaded": "Descargado exitosamente",
    "imported": "Importado exitosamente",
    "exported": "Exportado exitosamente",
    "synchronized": "Sincronizado exitosamente"
  }
}