{
  "common": {
    "loading": "Loading...",
    "error": "Error",
    "success": "Success",
    "save": "Save",
    "cancel": "Cancel",
    "delete": "Delete",
    "edit": "Edit",
    "create": "Create",
    "update": "Update",
    "confirm": "Confirm",
    "back": "Back",
    "next": "Next",
    "previous": "Previous",
    "search": "Search",
    "filter": "Filter",
    "clear": "Clear",
    "export": "Export",
    "import": "Import",
    "refresh": "Refresh",
    "settings": "Settings",
    "language": "Language",
    "timezone": "Timezone",
    "currency": "Currency",
    "region": "Region"
  },
  "navigation": {
    "dashboard": "Dashboard",
    "users": "Users",
    "reports": "Reports",
    "analytics": "Analytics",
    "compliance": "Compliance",
    "security": "Security",
    "monitoring": "Monitoring",
    "logs": "Logs",
    "alerts": "Alerts",
    "settings": "Settings",
    "profile": "Profile",
    "logout": "Logout"
  },
  "auth": {
    "login": "Login",
    "logout": "Logout",
    "register": "Register",
    "forgot_password": "Forgot Password",
    "reset_password": "Reset Password",
    "email": "Email",
    "password": "Password",
    "confirm_password": "Confirm Password",
    "remember_me": "Remember me",
    "sign_in": "Sign In",
    "sign_up": "Sign Up",
    "welcome_back": "Welcome back",
    "create_account": "Create account",
    "invalid_credentials": "Invalid credentials",
    "password_requirements": "Password must be at least 8 characters with uppercase, lowercase, number and special character"
  },
  "dashboard": {
    "title": "Enterprise Dashboard",
    "overview": "Overview",
    "key_metrics": "Key Metrics",
    "recent_activity": "Recent Activity",
    "quick_actions": "Quick Actions",
    "system_status": "System Status",
    "performance": "Performance",
    "security_alerts": "Security Alerts",
    "compliance_status": "Compliance Status"
  },
  "users": {
    "title": "User Management",
    "create_user": "Create User",
    "edit_user": "Edit User",
    "user_details": "User Details",
    "username": "Username",
    "email": "Email",
    "role": "Role",
    "status": "Status",
    "last_login": "Last Login",
    "created_at": "Created At",
    "actions": "Actions",
    "active": "Active",
    "inactive": "Inactive",
    "suspended": "Suspended",
    "admin": "Administrator",
    "user": "User",
    "manager": "Manager",
    "viewer": "Viewer"
  },
  "compliance": {
    "title": "Enterprise Compliance",
    "gdpr": "GDPR Compliance",
    "hipaa": "HIPAA Compliance",
    "sox": "SOX Compliance",
    "pci_dss": "PCI DSS Compliance",
    "iso_27001": "ISO 27001",
    "nist": "NIST Framework",
    "status": "Compliance Status",
    "last_audit": "Last Audit",
    "next_review": "Next Review",
    "compliant": "Compliant",
    "non_compliant": "Non-Compliant",
    "pending_review": "Pending Review",
    "remediation_required": "Remediation Required"
  },
  "security": {
    "title": "Security Center",
    "threat_detection": "Threat Detection",
    "vulnerability_scan": "Vulnerability Scan",
    "access_control": "Access Control",
    "encryption": "Encryption",
    "audit_logs": "Audit Logs",
    "incident_response": "Incident Response",
    "risk_assessment": "Risk Assessment",
    "security_policies": "Security Policies",
    "multi_factor_auth": "Multi-Factor Authentication",
    "zero_trust": "Zero Trust Architecture"
  },
  "monitoring": {
    "title": "System Monitoring",
    "uptime": "Uptime",
    "response_time": "Response Time",
    "error_rate": "Error Rate",
    "throughput": "Throughput",
    "cpu_usage": "CPU Usage",
    "memory_usage": "Memory Usage",
    "disk_usage": "Disk Usage",
    "network_traffic": "Network Traffic",
    "database_performance": "Database Performance",
    "api_health": "API Health"
  },
  "legal": {
    "terms_of_service": "Terms of Service",
    "privacy_policy": "Privacy Policy",
    "cookie_policy": "Cookie Policy",
    "data_processing": "Data Processing Agreement",
    "gdpr_notice": "GDPR Notice",
    "ccpa_notice": "CCPA Notice",
    "regional_compliance": "Regional Compliance",
    "data_retention": "Data Retention Policy",
    "right_to_deletion": "Right to Deletion",
    "data_portability": "Data Portability"
  },
  "enterprise": {
    "sla": "Service Level Agreement",
    "business_continuity": "Business Continuity",
    "disaster_recovery": "Disaster Recovery",
    "backup_status": "Backup Status",
    "failover": "Failover",
    "high_availability": "High Availability",
    "load_balancing": "Load Balancing",
    "auto_scaling": "Auto Scaling",
    "multi_region": "Multi-Region",
    "global_deployment": "Global Deployment"
  },
  "validation": {
    "required": "This field is required",
    "invalid_email": "Please enter a valid email address",
    "password_too_short": "Password must be at least 8 characters",
    "passwords_do_not_match": "Passwords do not match",
    "invalid_format": "Invalid format",
    "min_length": "Minimum length is {min} characters",
    "max_length": "Maximum length is {max} characters",
    "numeric_only": "Only numbers are allowed",
    "alphanumeric_only": "Only letters and numbers are allowed"
  },
  "errors": {
    "generic": "An unexpected error occurred",
    "network": "Network error. Please check your connection",
    "server": "Server error. Please try again later",
    "unauthorized": "You are not authorized to perform this action",
    "forbidden": "Access denied",
    "not_found": "Resource not found",
    "validation": "Please correct the highlighted errors",
    "timeout": "Request timeout. Please try again",
    "rate_limit": "Too many requests. Please wait and try again"
  },
  "success": {
    "created": "Successfully created",
    "updated": "Successfully updated",
    "deleted": "Successfully deleted",
    "saved": "Successfully saved",
    "uploaded": "Successfully uploaded",
    "downloaded": "Successfully downloaded",
    "imported": "Successfully imported",
    "exported": "Successfully exported",
    "synchronized": "Successfully synchronized"
  }
}